{
  "schema": "cxp/v1",
  "artifact_id": "WB-0009-cxp-artifact-spec-v1",
  "version": "1.0.0",
  "created_at": "2026-07-16T09:00:00Z",
  "publisher": {
    "id": "cyberdjs",
    "name": "CyberDJS"
  },
  "payload": {
    "file": "payload.tar.zst",
    "media_type": "application/vnd.cybercore.payload+tar",
    "compression": "zstd",
    "digest": {
      "algorithm": "sha256",
      "value": "0123456789abcdef0123456789abcdef0123456789abcdef0123456789abcdef"
    }
  },
  "compatibility": {
    "runtime": ">=0.1.0a1,<0.2.0"
  },
  "risk": "low"
}
